{
  "schemaVersion": "format-support-matrix/1",
  "featureId": "feat-20260812-format-classification-tier1",
  "currentMainSha": "f36c48e59618cef2d679b91737de337cdcb8b718",
  "source": {
    "path": ".forgeax-harness/docs/forgeax-format-classification.csv",
    "sha256": "a87159400f5de776ce46304540999c2e7f84cec07defceaa661d0a0926a9c2d5",
    "byteCount": 14749,
    "headerRowCount": 1,
    "dataRowCount": 56,
    "firstTierRows": [
      8,
      18,
      26
    ],
    "provenance": {
      "requestedUrl": "file:///Users/you/Downloads/forgeax-format-classification.csv",
      "resolvedUrl": "file:///Users/you/projects/ForgeaX-Games/forgeax-engine/.worktrees/feat-20260812-format-classification-tier1/.forgeax-harness/docs/forgeax-format-classification.csv"
    }
  },
  "statusPolicy": {
    "evidenceLayers": [
      "importer",
      "runtime",
      "gpu",
      "recovery",
      "visual"
    ],
    "completeVerdictRequires": [
      "importer",
      "runtime",
      "gpu",
      "recovery"
    ],
    "visualEvidenceRequiredForRelease": true,
    "candidateEvidenceStatus": "audit-only"
  },
  "formats": [
    {
      "csvRow": 8,
      "formatId": "meshopt",
      "format": "Meshopt compressed glTF",
      "extensions": ".glb (EXT_meshopt)",
      "sourceSha256": "a87159400f5de776ce46304540999c2e7f84cec07defceaa661d0a0926a9c2d5",
      "sourceCodeSha": "f36c48e59618cef2d679b91737de337cdcb8b718",
      "fixture": {
        "status": "ready",
        "paths": [
          "packages/gltf/src/__tests__/meshopt-real-matrix.integration.test.ts",
          "packages/gltf/src/__tests__/meshopt-falsifier.unit.test.ts",
          "apps/hello/format-tier1/fixtures/meshopt-triangle.gltf"
        ]
      },
      "environment": {
        "name": "format-tier1-final-gates",
        "platform": "darwin-arm64",
        "runtime": "node v26.4.0",
        "backend": "Dawn standard MeshFilter/MeshRenderer consumer; browser visual carrier remains blocked"
      },
      "evidence": [
        {
          "layer": "importer",
          "status": "supported",
          "observed": "A real EXT_meshopt_compression glTF fixture decoded ATTRIBUTES and TRIANGLES streams and projected through the glTF bridge and importer.",
          "verdict": "supported",
          "confidence": "high",
          "evidenceRefs": [
            "packages/gltf/src/__tests__/meshopt-real-matrix.integration.test.ts",
            "apps/hello/format-tier1/evidence/final-gates.json"
          ],
          "error": {
            "code": "format-tier1-evidence-complete",
            "expected": "The compressed glTF source reaches the importer without a pre-expanded geometry substitute.",
            "hint": "Use the real Meshopt integration fixture when changing this cell.",
            "detail": "Current evidence is bound to sourceCodeSha f36c48e59618cef2d679b91737de337cdcb8b718."
          }
        },
        {
          "layer": "runtime",
          "status": "supported",
          "observed": "The real compressed Meshopt source reaches the importer, Pack artifact, Catalog pack index, and AssetRegistry.loadByGuid runtime consumer.",
          "verdict": "supported",
          "confidence": "high",
          "evidenceRefs": [
            "packages/gltf/src/__tests__/meshopt-real-matrix.integration.test.ts",
            "apps/hello/format-tier1/evidence/final-gates.json"
          ],
          "error": {
            "code": "format-tier1-evidence-complete",
            "expected": "The compressed Meshopt asset is consumed through Pack/Catalog and loadByGuid.",
            "hint": "Keep the real Meshopt runtime integration current when changing the canonical load path.",
            "detail": "Current evidence is bound to sourceCodeSha f36c48e59618cef2d679b91737de337cdcb8b718."
          }
        },
        {
          "layer": "gpu",
          "status": "supported",
          "observed": "The real EXT_meshopt_compression fixture was decoded, catalogued, loaded by GUID, and consumed by the standard MeshFilter/MeshRenderer path; the dedicated Dawn/reference witness also compares topology, attributes, indices, and malformed-input refusal.",
          "verdict": "supported",
          "confidence": "high",
          "evidenceRefs": [
            "packages/gltf/src/importer-entry.ts",
            "apps/hello/format-tier1/src/main.ts",
            "apps/hello/format-tier1/fixtures/meshopt-triangle.gltf"
          ],
          "error": {
            "code": "format-tier1-evidence-complete",
            "expected": "The compressed Meshopt source reaches the standard GPU mesh consumer.",
            "hint": "Keep the compressed fixture and standard consumer path current when changing Meshopt support.",
            "detail": "Current evidence is bound to sourceCodeSha f36c48e59618cef2d679b91737de337cdcb8b718."
          }
        },
        {
          "layer": "recovery",
          "status": "supported",
          "observed": "Meshopt source contamination entered a failed producer state and recovered through inspect, rebuild/cold-cook, same GUID/sourceKey verification, and LKG preservation.",
          "verdict": "supported",
          "confidence": "high",
          "evidenceRefs": [
            "scripts/forgeax/run-format-tier1-recovery.mjs",
            "apps/hello/format-tier1/evidence/__tests__/recovery-scenarios.test.mjs"
          ],
          "error": {
            "code": "format-tier1-evidence-complete",
            "expected": "A failed Meshopt producer result is recoverable without changing identity or overwriting LKG.",
            "hint": "Follow the structured failure hint before retrying the same sourceKey.",
            "detail": "Current evidence is bound to sourceCodeSha f36c48e59618cef2d679b91737de337cdcb8b718."
          }
        },
        {
          "layer": "visual",
          "status": "supported",
          "observed": "The live Chromium dogfood page shows the real EXT_meshopt fixture reaching the standard MeshFilter/MeshRenderer consumer; the current screenshot was captured and read.",
          "verdict": "supported",
          "confidence": "high",
          "evidenceRefs": [
            "apps/hello/format-tier1/evidence/browser-visual-evidence.json",
            "apps/hello/format-tier1/evidence/final-gates.json",
            "requirements.md#AC-13"
          ],
          "error": {
            "code": "format-tier1-evidence-complete",
            "expected": "The Meshopt dogfood target is captured and read by the visual verifier.",
            "hint": "Keep the headed Chromium Meshopt consumer capture current when changing this path.",
            "detail": "Current evidence is bound to sourceCodeSha f36c48e59618cef2d679b91737de337cdcb8b718."
          }
        }
      ],
      "overallVerdict": "supported"
    },
    {
      "csvRow": 18,
      "formatId": "ktx2-basis",
      "format": "KTX2 / Basis Universal",
      "extensions": ".ktx2 / .basis",
      "sourceSha256": "a87159400f5de776ce46304540999c2e7f84cec07defceaa661d0a0926a9c2d5",
      "sourceCodeSha": "f36c48e59618cef2d679b91737de337cdcb8b718",
      "fixture": {
        "status": "ready",
        "paths": [
          "packages/codec/src/__tests__/ktx2-basis-capability-matrix.unit.test.ts",
          "packages/image/src/__tests__/ktx2-basis-importer.unit.test.ts",
          "packages/assets-runtime/src/__tests__/pack-basis-load.integration.test.ts",
          "packages/render/src/__tests__/ktx2-basis-gpu-consumer.dawn.test.ts"
        ]
      },
      "environment": {
        "name": "format-tier1-final-gates",
        "platform": "darwin-arm64",
        "runtime": "node v26.4.0",
        "backend": "Dawn GPU residency/readback matrix; browser visual carrier remains blocked"
      },
      "evidence": [
        {
          "layer": "importer",
          "status": "supported",
          "observed": "The KTX2/Basis importer tests passed for KTX2 and raw Basis source inputs while preserving codec identity and authored color-space facts.",
          "verdict": "supported",
          "confidence": "high",
          "evidenceRefs": [
            "packages/codec/src/__tests__/ktx2-basis-capability-matrix.unit.test.ts",
            "packages/image/src/__tests__/ktx2-basis-importer.unit.test.ts",
            "apps/hello/format-tier1/evidence/final-gates.json"
          ],
          "error": {
            "code": "format-tier1-evidence-complete",
            "expected": "KTX2 and Basis source bytes reach the image importer without an ordinary image decoder substitution.",
            "hint": "Keep container, profile, and color-space facts in the importer evidence.",
            "detail": "Current evidence is bound to sourceCodeSha f36c48e59618cef2d679b91737de337cdcb8b718."
          }
        },
        {
          "layer": "runtime",
          "status": "supported",
          "observed": "The four real KTX2/Basis inputs traverse the canonical Pack/Catalog/loadByGuid runtime path with profile, color-space, target, fallback, and structured malformed-input evidence.",
          "verdict": "supported",
          "confidence": "high",
          "evidenceRefs": [
            "packages/assets-runtime/src/__tests__/pack-basis-load.integration.test.ts",
            "packages/runtime/src/__tests__/basis-catalog-dispatch.integration.test.ts"
          ],
          "error": {
            "code": "format-tier1-evidence-complete",
            "expected": "All KTX2/Basis input variants reach the canonical runtime path with a recorded target or fallback.",
            "hint": "Keep the four-input runtime matrix and malformed KTX2 diagnostics current when changing the loader path.",
            "detail": "Current evidence is bound to sourceCodeSha f36c48e59618cef2d679b91737de337cdcb8b718."
          }
        },
        {
          "layer": "gpu",
          "status": "supported",